id,created_at,conversation_id,tweet,retweet_count,like_count,reply_count,quote_count,expanded_url,language,possibly_sensitive,in_reply_to_user_id,username
1542598099918618625,2022-06-30 19:57:01+00:00,1542598099918618625,"RT @TheKingsFund: And finally, the overall winner of the 2022 @GSK IMPACT Awards is..... @mapyoungpeople - congratulations! 🎉 #GSKIMPACTUK…",9,0,0,0,,en,False,,GSK
1542592559716999170,2022-06-30 19:35:00+00:00,1542592559716999170,"@dementiaforward is one of our 2022 #GSKIMPACTUK Award winners. 

Click here to find out more about the amazing work of this charity 👇",0,2,0,1,,en,False,1253307681705791488,GSK
1542591047364132864,2022-06-30 19:29:00+00:00,1542591047364132864,"@BrigstoweInfo is one of our 2022 #GSKIMPACTUK Award winners.

Click here to find out more about the amazing work of this charity 👇",3,3,0,0,,en,False,3364106609,GSK
1542589790763323394,2022-06-30 19:24:00+00:00,1542589790763323394,"@IronOverloadUK is one of our 2022 #GSKIMPACTUK Award winners. 

Click here to find out more about the amazing work of this charity👇",0,1,0,0,,en,False,1117361532,GSK
1542587524119511045,2022-06-30 19:15:00+00:00,1542587524119511045,"@mapyoungpeople is one of our 2022 #GSKIMPACTUK Award winners. 

Click here to find out more about the amazing work of this charity 👇",0,0,0,1,,en,False,2148943154,GSK
1542586267728232454,2022-06-30 19:10:00+00:00,1542586267728232454,"@ScotFamADrugs is one of our 2022 #GSKIMPACTUK Award winners. 

Click here to find out more about the amazing work of this charity 👇",1,2,0,1,,en,False,284573291,GSK
1542584507089534979,2022-06-30 19:03:00+00:00,1542584507089534979,"@BromleyWA is one of our 2022 #GSKIMPACTUK Award winners. 

Click here to find out more about the amazing work of this charity👇",3,5,0,0,,en,False,1467172664,GSK
1542583248592801794,2022-06-30 18:58:00+00:00,1542583248592801794,"@Dadsunltd  is one of our 2022 #GSKIMPACTUK Award winners. 

Click here to find out more about the amazing work of this charity 👇",4,8,0,1,,en,False,775719655214354432,GSK
1542581736172916742,2022-06-30 18:52:00+00:00,1542581736172916742,"@trekstock is one of the 2022 #GSKIMPACTUK Award winners. 

Click here to find out more about their work 👇",1,2,1,0,,en,False,19345062,GSK
1542577460914651136,2022-06-30 18:35:01+00:00,1542577460914651136,"@the_BHA is one of the 2022 #GSKIMPACTUK Award winners. 

Click here to find out more about their work 👇",6,8,0,4,,en,False,404083506,GSK
1542568657028521985,2022-06-30 18:00:02+00:00,1542568657028521985,"LIVE NOW on Facebook celebrating the amazing winners of the #GSKIMPACTUK Awards - come and share the great work of your favourite.

 👉 https://t.co/4NQGi7yz9F https://t.co/1rYWeYCE2N",3,13,0,0,https://gsk.to/3OOVzow,en,False,,GSK
1542538459709046791,2022-06-30 16:00:02+00:00,1542538459709046791,"Tonight, the #GSKIMPACTUK Awards recognise the amazing work this year’s winners do to improve the health and wellbeing within their communities.  

Tune in LIVE on Facebook at 19:00 to celebrate with us 👏",3,15,1,0,,en,False,,GSK
1542523906627493888,2022-06-30 15:02:12+00:00,1542523906627493888,Keeping up the momentum from #COP26 is key if we are to protect human health and the health of our planet. Sectors will need to work together so good to connect with other businesses today as part of #LCAW2022 https://t.co/r2LTkTP93h,1,10,0,0,https://twitter.com/AlokSharma_RDG/status/1542478759164792832,en,False,,GSK
1542119441210679298,2022-06-29 12:15:00+00:00,1542119441210679298,Congratulations to @HealthTree for winning the first #TargetTheFuture Think Tank Challenge! The award will accelerate efforts to ensure equitable care for #multiplemyeloma patients. Read more on their plans to help the community.,2,14,1,1,,en,False,,GSK
1542055343521406976,2022-06-29 08:00:18+00:00,1542055343521406976,"This week we are celebrating 25 years of the #GSKIMPACTUK Awards, supporting incredible local charities working to improve the health and wellbeing of their communities. Over 25 years we’ve donated nearly £7.7m to 518 charities across the UK. https://t.co/OPxSSgzvWV",6,18,0,2,https://twitter.com/GSK/status/1542055343521406976/video/1,en,False,,GSK
1542047722844332032,2022-06-29 07:30:01+00:00,1542047722844332032,"The GSK IMPACT Awards in partnership with @TheKingsFund are live on Facebook tomorrow! 

Join us to celebrate the amazing work our winning charities do to support community health and wellbeing across the UK.

#GSKIMPACTUK https://t.co/tvVpXg7Mog",4,13,2,1,https://twitter.com/GSK/status/1542047722844332032/photo/1,en,False,,GSK
1541835979878793218,2022-06-28 17:28:38+00:00,1541835979878793218,We’re using advanced technologies to gain a deeper understanding of human genetics and our immune system. #AheadTogether https://t.co/kpC3nKxsme,5,15,0,0,https://twitter.com/GSK/status/1541835979878793218/video/1,en,False,,GSK
1541692879663505411,2022-06-28 08:00:00+00:00,1541692879663505411,"Katie is on a mission to use data and tech to transform medicine discovery. No wonder the story of Apollo 11 stays top of mind for this Senior Director of AI/ML Engineering. 

Read more about her team’s mission 👇 #ItsInOurGenes",2,11,0,0,,en,False,,GSK
1540682227045916673,2022-06-25 13:04:02+00:00,1540682227045916673,"News for #investors and #media: We’ve just announced new data for an investigational treatment for chronic #hepatitisB at #ILC2022. 

Find out more: https://t.co/BaSSRCKr4m https://t.co/iVXEmSFa4D",5,20,0,1,https://gsk.to/3OILyZQ,en,False,,GSK
1540318824888680449,2022-06-24 13:00:00+00:00,1540318824888680449,"Human genetics &amp; AI/ML are 2 pieces of the drug discovery puzzle. 

For Greg, our Scientific Director of Research in Novel Human Genetics, solving puzzles is a passion and part of the job. Watch his story 👇
#ItsInOurGenes",1,13,0,1,,en,False,,GSK
1540235850184888327,2022-06-24 07:30:17+00:00,1540235850184888327,"Discover what a functional cure would mean to those living with chronic #hepatitisB and how scientists are researching new solutions to achieve this. 

#ILC2022 https://t.co/bwwQwWuIyc",3,12,2,0,https://twitter.com/GSK/status/1540235850184888327/video/1,en,False,,GSK
1540208822786162690,2022-06-24 05:42:53+00:00,1540208822786162690,#News for #investors and #media: Today we have announced results from a clinical trial of a bivalent adjuvanted COVID-19 vaccine candidate we co-developed with @sanofi.,2,19,1,1,,en,False,,GSK
1539963466815094784,2022-06-23 13:27:56+00:00,1539650052804579328,@Damini44948789 Hello - Our local office in India is best equipped to help you with products for your local market.  You can find their contact information using this link: https://t.co/0RPjiPNJrg,0,1,0,0,http://india-pharma.gsk.com/en-in/contact-us/,en,False,1106474861126279168,GSK
1539932012806651904,2022-06-23 11:22:57+00:00,1539932012806651904,"News for #investors and #media: 

Today, we’ve announced £1bn investment in R&amp;D over ten years to get ahead of infectious diseases that disproportionately impact lower-income countries.

Read more: https://t.co/fqn4kacyl5 https://t.co/0aZ1A9PvqW",8,36,1,3,https://gsk.to/3bb7RsK,en,False,,GSK
1539626267842166785,2022-06-22 15:08:01+00:00,1539626267842166785,"We aim to stop the progression of liver damage for people living with chronic #hepatitisB. 

Our researchers are investigating new solutions to get ahead of chronic hepatitis B together. #ILC2022",4,14,1,0,,en,False,,GSK
1539330760766853123,2022-06-21 19:33:47+00:00,1539330760766853123,"Drug-resistant infections threaten our health and economic security.

Tracking patterns of resistance is key to getting ahead of this threat and we’re pleased to contribute surveillance data to the new #AMR Register.

Find out more: https://t.co/aiFZI8XNGT https://t.co/PuaXui7hgz",2,7,0,0,https://gsk.to/3ybELTn,en,False,,GSK
1539158017479933953,2022-06-21 08:07:22+00:00,1539158017479933953,"‘‘Discrimination and stigma continue to fuel inequalities in health care among sexual and gender minority groups.’ 

This #PrideMonth @matthewhalse of @ViiVHC explains why we must continue to work towards better #LGBTI health equity.

#LGBTQ  #LGBTQIA #inclusion",3,12,0,0,,en,False,,GSK
1539116542482591744,2022-06-21 05:22:33+00:00,1539116542482591744,We’re using vaccine #innovation and technologies to explore new treatment strategies and get ahead of disease.,35,158,61,10,,en,False,,GSK
1538790643581046784,2022-06-20 07:47:33+00:00,1538790643581046784,"#DYK respiratory syncytial virus (#RSV) is a leading cause of acute respiratory disease globally?  

This week, we are at #ISPPD12 in Toronto, Canada discussing RSV and pneumococcal disease with pneumonia researchers from all around the globe. https://t.co/1n3kc6Msn6",4,20,0,0,https://twitter.com/GSK/status/1538790643581046784/video/1,en,False,,GSK
1537770884563447811,2022-06-17 12:15:23+00:00,1537770884563447811,We’re proud of our past but excited for our future. See more: https://t.co/vqHLrDEuBZ #AheadTogether https://t.co/zxZjFQRmGA,15,46,4,5,https://gsk.to/3NXAkRx,en,False,,GSK
1537680814645063681,2022-06-17 06:17:29+00:00,1537680814645063681,In @NatureGenet paper GSK &amp; @OpenTargets researchers pinpoint 127 genes involved in immune diseases from measuring 650K cells. Learn more in Fierce Biotech. #Innovation #Immunology #Genetics,8,36,1,0,,en,False,,GSK
1537068296394137600,2022-06-15 13:43:33+00:00,1537068296394137600,We’ve revealed the next step on our journey to become a company purely focused on biopharma innovation – here’s a taste of what more there is to come. See more: https://t.co/VHHDCNb07a #AheadTogether https://t.co/tt1zJzXTcy,7,20,1,0,https://gsk.to/3MUTCWr,en,False,,GSK
1536727954776104961,2022-06-14 15:11:10+00:00,1536727954776104961,"This year, we launched the Frontiers in Myeloma event to bring together the #multiplemyeloma community to find solutions to the most pressing challenges facing patients.

Read more from GSK’s Tania Small about the inspiring discussion held at #EHA2022. #mmsm",3,8,1,0,,en,False,,GSK
1536643611831455745,2022-06-14 09:36:01+00:00,1536643611831455745,"Jigar is determined to use his own experience to raise the visibility of #LGBTQ+ people, challenging stigma to deliver better for LGBTQ+ patients. 

#diversty #inclusion #LGBTQIA+ #pridemonth 🏳‍🌈",2,8,0,0,,en,False,,GSK
1536366829232304128,2022-06-13 15:16:11+00:00,1535683383459598338,"@ZamirKh42485760 Thank you for alerting us to this issue. I've forwarded your message to the appropriate team. If you have additional questions, please reach out to our team in India: https://t.co/0RPjiQ5kiO",0,0,0,0,http://india-pharma.gsk.com/en-in/contact-us/,en,False,1279296293777571840,GSK
1536357897571119104,2022-06-13 14:40:41+00:00,1536357897571119104,"In case you missed it: “This is our time.” See our CEO, Emma Walmsley, speak about how we’ll tackle of the world’s toughest healthcare challenges. See more: https://t.co/jfNmbZJ2md #AheadTogether https://t.co/EgloJx2C2d",9,21,0,0,https://gsk.to/3zAiPm2,en,False,,GSK
1536317463620632576,2022-06-13 12:00:01+00:00,1536317463620632576,We are feeling energised and inspired after learning from and collaborating with the #multiplemyeloma community at #EHA2022. We gained valuable insights into the latest haematologic research and are committed to applying these into to our work to improve patient outcomes. #mmsm,2,8,1,0,,en,False,,GSK
1536270007017295872,2022-06-13 08:51:26+00:00,1536270007017295872,"A @NatureGenet paper is first to track gene expression in 650K single T-cells over time. Our @OpenTargets collab identifies links between 127 genes and immune diseases. Read our paper with @sangerinstitute @GosiaTrynka
#Innovation #Immunology #Genetics",8,60,3,1,,en,False,,GSK
1535955070931681280,2022-06-12 12:00:00+00:00,1535955070931681280,"#EHA2022 marked 30 years of innovation from the annual congress.  

At this year’s meeting, we were excited to share our latest research and celebrate the progress made during the last three decades for #multiplemyeloma patients. #mmsm",4,7,2,0,,en,False,,GSK
1535577587027693568,2022-06-11 11:00:01+00:00,1535577587027693568,"We are driven to get ahead of #cancer through our ongoing research. 

Learn about our latest advances at #EHA2022. #mmsm",7,14,0,1,,en,False,,GSK
1535544753651163139,2022-06-11 08:49:32+00:00,1535544753651163139,We’re getting ahead of disease together. See more: https://t.co/nv5Pu6K0o0 #AheadTogether https://t.co/APeQNxsiio,5,17,1,0,https://gsk.to/3aGIjUd,en,False,,GSK
1535260508777070593,2022-06-10 14:00:03+00:00,1535260508777070593,#Krebserkrankungen durch kontinuierliche Forschung immer einen Schritt voraus sein. Das ist unser Ziel. Mehr dazu beim EHA-Kongress 2022. #MMSM,2,68,13,4,,de,False,,GSK
1535260507204198400,2022-06-10 14:00:03+00:00,1535260507204198400,"30 Jahre Innovation auf dem #EHA-Kongress2022. Wir präsentierten neueste Forschungsergebnisse und feierten den Fortschritt, der in den letzten drei Jahrzehnten für Patient*innen mit #MultiplemMyelom erzielt wurde. #MMSM",3,20,2,1,,de,False,,GSK
1535260505715220481,2022-06-10 14:00:02+00:00,1535260505715220481,Con #EHA2022 se cumplen 30 años de innovación de este Congreso anual. Este año estamos orgullosos de poder compartir nuestros últimos avances en investigación y de celebrar la evolución alcanzada en las últimas tres décadas para los pacientes con #MielomaMúltiple. #mmsm,9,90,1,0,,es,False,,GSK
1535260495707512832,2022-06-10 14:00:00+00:00,1535260495707512832,"To help kick off #EHA2022 we hosted the inaugural Frontiers in Myeloma event.   

We are working with #multiplemyeloma leaders to find new solutions that address patient needs. #mmsm",3,5,0,0,,en,False,,GSK
1535260494205943809,2022-06-10 14:00:00+00:00,1535260494205943809,En el Congreso #EHA2022 compartimos nuestros últimos avances en investigación sobre #MielomaMúltiple. Seguimos trabajando para adelantarnos al cáncer y mejorar la calidad de vida de los pacientes. #mmsm,8,34,0,0,,es,False,,GSK
1535242536553439237,2022-06-10 12:48:38+00:00,1535242536553439237,We’re using vaccine #innovation and technologies to explore new treatment strategies and get ahead of disease https://t.co/WZLHbonXhk,6,11,1,0,https://www.nature.com/articles/d42473-022-00116-y,en,False,,GSK
1535166190292766721,2022-06-10 07:45:16+00:00,1535166190292766721,"An estimated 300,000 adults are hospitalised because of respiratory syncytial virus (RSV) each year.

Yet, advances in science mean we could be on the cusp of finding new solutions. Come behind the science with us to find out how we’re hoping to get ahead of #RSV. https://t.co/NCzkFBr6Kv",7,36,0,3,https://twitter.com/GSK/status/1535166190292766721/video/1,en,False,,GSK
1534882749638660101,2022-06-09 12:58:58+00:00,1534882749638660101,"GSK is changing. After the proposed demerger of our world leading consumer health business, @Haleon_health, we will be a company purely focused on biopharma innovation with a new purpose; to unite science, technology and talent to get ahead of disease together. #AheadTogether https://t.co/ZNSWOZ0I4Z",15,61,1,1,https://twitter.com/GSK/status/1534882749638660101/video/1,en,False,,GSK
1534852729134276610,2022-06-09 10:59:41+00:00,1534852729134276610,"GSK is changing. Watch our CEO, Emma, explain how we are getting ahead of disease together, to positively impact the health of 2.5bn people over the next 10 years. See more: https://t.co/orPBmFotAT #AheadTogether https://t.co/6vUJg5bwn4",28,84,2,3,https://www.gsk.com/en-gb/about-us/,en,False,,GSK
1534849880266776576,2022-06-09 10:48:22+00:00,1534849880266776576,"GSK is changing. Watch our CEO, Emma, explain how we are getting ahead of disease together, to positively impact the health of 2.5bn people over the next 10 years.",3,57,26,5,,en,False,,GSK
1534849598275342337,2022-06-09 10:47:15+00:00,1534849598275342337,"GSK is changing. Watch our CEO, Emma, explain how we are getting ahead of disease together, to positively impact the health of billions of people over the next 10 years.",3,40,28,3,,en,False,,GSK
1534849029745815553,2022-06-09 10:44:59+00:00,1534849029745815553,GSK is changing. We’re excited to share how we’ll get ahead of disease together in a new era for GSK. #AheadTogether,0,42,7,0,,en,False,,GSK
1534778627031810048,2022-06-09 06:05:14+00:00,1534778627031810048,GSK is changing. Find out what getting ahead of disease together is all about #AheadTogether https://t.co/VztCnJTdoV,40,106,2,9,https://twitter.com/GSK/status/1534778627031810048/video/1,en,False,,GSK
1534535719447822336,2022-06-08 14:00:00+00:00,1534535719447822336,"We are proud to engage with the oncology community at meetings like #ASCO22 to discuss how we can work collectively to transform cancer care. 

Hear more from Dr Tania Small  👇",3,13,3,0,,en,False,,GSK
1534190946673369089,2022-06-07 15:10:00+00:00,1534190946673369089,In @NatureGenet paper GSK &amp; @OpenTargets researchers pinpoint 127 genes involved in immune diseases from measuring 650K cells. Learn more in Fierce Biotech. #Innovation #Immunology #Genetics,7,17,0,0,,en,False,,GSK
1534115495649198081,2022-06-07 10:10:11+00:00,1534115495649198081,"Just as scientific innovation is essential to advancing health, systemic healthcare innovation is required to tackle disparities, particularly in cancer care.

Find out how science, technology and partnership can help us get ahead of disease https://t.co/5BcsBL5qf4
@endpts",3,10,1,0,http://ms.spr.ly/6016bjMNs,en,False,,GSK
1533795844839084034,2022-06-06 13:00:00+00:00,1533795844839084034,"Collaborative partnerships are key to understanding the human body in a way that we haven’t been able to before. 
Hear how community fundraising inspired Meg to run GSK’s genetic partnerships as Sr. Director of Genomic Sciences. https://t.co/48lOePHQCa #ItsInOurGenes #Innovation",2,4,1,1,https://gsk.to/3N37dvv,en,False,,GSK
1533776970668027904,2022-06-06 11:45:00+00:00,1533776970668027904,"We’re excited to be back at #ASCO22 in-person after two years of virtual meetings. 

Nina Mojas, SVP, Oncology Global Product Strategy, GSK, addresses how this year’s meeting is helping GSK and the cancer community connect to make a positive impact for patients.",3,12,1,0,,en,False,,GSK
1533206966063054848,2022-06-04 22:00:00+00:00,1533206966063054848,"#News for #Media and #Investors: At #ASCO22, we’re sharing data from our multiple myeloma clinical trial programme as we work to bring new options for patients. Visit our site to learn more 👉 https://t.co/ncSZFkmGdm",3,12,0,0,https://gsk.to/3zbDVH1,en,False,,GSK
1532723841222467589,2022-06-03 14:00:15+00:00,1532723841222467589,"Advances in vaccine technologies are phenomenal and the combination of science, technology and talent will catapult us to be even more ambitious for patients👂 

Take a listen below to learn more from our scientists at @PharmaReview  👇 https://t.co/eN9q5Rnw8y",2,7,1,0,https://twitter.com/GSK/status/1532723841222467589/video/1,en,False,,GSK
1532715794383134720,2022-06-03 13:28:16+00:00,1532715794383134720,"During #EULAR2022 this week, we’re asking the question: What if Remission were the Target of Lupus Care? Go #BehindtheScience of treat-to-target – an approach that could help prevent organ damage. modify the course of #lupus, and address the unmet needs of millions.",7,34,2,0,,en,False,,GSK
1532693582200594432,2022-06-03 12:00:00+00:00,1532693582200594432,"During #EULAR2022 this week, we’re asking the question: What if Remission were the Target of Lupus Care? 

Go #BehindtheScience of treat-to-target – an approach that could help prevent organ damage, modify the course of #lupus, and address the unmet needs of millions.",4,8,0,0,,en,False,,GSK
1532618082916655106,2022-06-03 07:00:00+00:00,1532618082916655106,"Today at #EULAR we’re hosting a symposium on eosinophil-driven diseases, a focus of our research. 

Eosinophils are a type of white blood cell which play a role in diseases such as severe eosinophilic #asthma and Eosinophilic Granulomatosis with PolyAngiitis (EGPA).",3,6,1,0,,en,False,,GSK
1532363988536905731,2022-06-02 14:10:19+00:00,1532363988536905731,"Nearly 90% of @WorldLupusFed survey respondents reported #lupus-related organ damage impacted their quality of life.

👉Go #BehindtheScience to learn about disease modification in lupus management and why we’re asking What if Remission were the Target of Lupus Care? #EULAR2022",12,24,0,0,,en,False,,GSK
1532363747699961857,2022-06-02 14:09:22+00:00,1532363747699961857,"This week at #EULAR2022 we’re sharing our latest research in #lupus. There is so much more we can do to improve lupus care and get ahead of this debilitating disease together.

👉Go #BehindtheScience to learn why we’re asking What if Remission were the Target of Lupus Care?",8,14,1,0,,en,False,,GSK
1532361399405518854,2022-06-02 14:00:02+00:00,1532361399405518854,"Compelling advances in oncology are built on a strong foundation of early clinical research. 

Read Hesham Abdullah’s article about our approach to research at #ASCO22 and how it’s contributing to a pipeline with the potential to transform outcomes for patients.",5,11,0,0,,en,False,,GSK
1532361394946863105,2022-06-02 14:00:01+00:00,1532361394946863105,"Nina Mojas, SVP Oncology Global Product Strategy de GSK explica cómo GSK y toda la comunidad oncológica continúa innovando y colaborando para tener un impacto positivo en los pacientes.",87,569,11,8,,es,False,,GSK
1532270794583187456,2022-06-02 08:00:00+00:00,1532270794583187456,"Immuno-oncology is a powerful tool in personalising cancer treatment. 

Learn more about our research into this current therapeutic approach at #ASCO22.",4,18,0,1,,en,False,,GSK
1532269111434219520,2022-06-02 07:53:19+00:00,1532269111434219520,"There is #OnlyOneEarth and we must all play our part to protect it. As part of @TheSMI Health Systems Taskforce, we're calling for collective action across all aspects of healthcare delivery to accelerate decarbonisation of the sector: https://t.co/1oBCIiFxi2 #WorldEnvironmentDay",1,5,0,0,https://bit.ly/3N3A5Uq,en,False,,GSK
1532051851834806274,2022-06-01 17:30:00+00:00,1532051851834806274,"#TargetTheFuture’s Think Tank Challenge will support and accelerate the strongest, most innovative idea to help those impacted by #multiplemyeloma. 

Stay tuned to see how we are advancing oncology research at #ASCO22.",2,8,0,0,,en,False,,GSK
1532017400509612035,2022-06-01 15:13:06+00:00,1531551776645816322,"@p_r_d_tweets I would also suggest that you reach out to your local healthcare provider to discuss other medications that may already be available.

-Crystal",0,0,0,0,,en,False,871649972,GSK
1532016919989059585,2022-06-01 15:11:11+00:00,1531551776645816322,"@p_r_d_tweets I'm sorry, but the social media team is not permitted to answer product related questions. The only team that would be able to speak with you regarding products for your local market is our team in the UAE.",0,0,0,0,,en,False,871649972,GSK
1531972254887821312,2022-06-01 12:13:42+00:00,1531972254887821312,We can confirm the circular and prospectus in relation to the proposed demerger of Haleon have been approved by the FCA and published by GSK and @Haleon_health.,4,10,0,0,,en,False,,GSK
1531880149167243265,2022-06-01 06:07:43+00:00,1531880149167243265,We have submitted the circular and prospectus in relation to our proposed demerger of our consumer healthcare business @Haleon_health to the FCA for approval and expect to publish the documents later today. https://t.co/Z1LNVmclJT,2,13,0,0,https://twitter.com/GSK/status/1531880149167243265/photo/1,en,False,,GSK
1531876952742707200,2022-06-01 05:55:01+00:00,1531876952742707200,"Please read this cautionary statement regarding forward-looking statements 
https://t.co/jQQcW8CcHR
https://t.co/jQQcW8CcHR",1,3,0,0,https://gsk.to/3NesAdC,en,False,,GSK
1531680870633029633,2022-05-31 16:55:51+00:00,1531680870633029633,#News for #Investors and #Media ¬Today’s proposed acquisition of @Affinivax complements our pipeline of paediatric and adult vaccines and portfolio of technologies as we continue to innovate so we can get ahead of disease together https://t.co/8Z4174d3FM,3,8,0,0,https://twitter.com/GSK/status/1531680870633029633/video/1,en,False,,GSK
1531627626917421064,2022-05-31 13:24:17+00:00,1531551776645816322,"@p_r_d_tweets Our local office in the UAE is best equipped to answer questions about the availability of products in your local market: https://t.co/aRqktHvDQ5

Please note that our offices are not open in the evenings or on the weekends.
Best wishes,

Crystal",0,0,1,0,https://www.gsk.com/en-gb/contact-us/worldwide/united-arab-emirates,en,False,871649972,GSK
1531576120029716480,2022-05-31 09:59:36+00:00,1531576120029716480,#News for #Investors and #Media. Today we announced the proposed acquisition of @Affinivax. This news follows on from our recent proposed acquisition of Sierra Oncology as we continue to focus on developing a strong portfolio of innovative vaccines and specialty medicines. https://t.co/6hY9zhekZl,1,18,1,1,https://twitter.com/GSK/status/1531576120029716480/video/1,en,False,,GSK
1531542244137881603,2022-05-31 07:45:00+00:00,1531542244137881603,"This week we’re sharing our latest immunology research at #EULAR2022. With decades of our immunology research behind us, we’re advancing medicine by unlocking the secrets of the immune system. 

Read more about our research into Immuno-inflammation 👇 
https://t.co/UueCUHFO0s",6,13,0,0,https://gsk.to/3N4GyOY,en,False,,GSK
1531517359227387905,2022-05-31 06:06:07+00:00,1531517359227387905,"#News for #Investors and #Media. Today, we’ve announced the proposed acquisition of @Affinivax. If approved, this will further strengthen our vaccine pipeline and provides access to a new, potentially disruptive technology. More info at https://t.co/dsMXEjG4zP https://t.co/NTjRHp3EQT",5,19,3,0,http://gsk.com,en,False,,GSK
